<?xml version="1.0" encoding="UTF-8"?>
<FlexModel xmlns:xsi="http://www.w3.org/2001/XMLSchema-instance"
           xsi:noNamespaceSchemaLocation="FlexModel.xsd">

    <!--Start Relationship Types-->

    <RelationshipType>
        <codeName>extends</codeName>
        <description>OO Extension</description>
    </RelationshipType>
    <RelationshipType>
        <codeName>references</codeName>
        <description>Like an RDB FK</description>
    </RelationshipType>

    <!--Start Primitive (data) Types-->

    <PrimitiveType>
        <codeName>long</codeName>
        <description>Long integer</description>
    </PrimitiveType>
    <PrimitiveType>
        <codeName>string</codeName>
        <description>Character String</description>
    </PrimitiveType>

    <PrimitiveType>
        <codeName>date</codeName>
        <description>A date or timestamp</description>
    </PrimitiveType>

    <!--
      Very Base EntityType's
    -->

    <EntityType>
        <codeName>FlexEntity</codeName>
        <description>Base class of all types including BusinessEntity and MetaEntity</description>
    </EntityType>
    <Attribute>
        <codeName>oid</codeName>
        <description>System identifier</description>
        <length>0</length>
        <parentEntityTypeName>FlexEntity</parentEntityTypeName>
        <dataTypeName>long</dataTypeName>
    </Attribute>

    <EntityType>
        <codeName>BusinessEntity</codeName>
        <description>Base Business Entity Types such as a GeneralWorkRequest</description>
        <serviceGroupOid>0</serviceGroupOid>
    </EntityType>

    <TypeRelationship>
        <codeName>extends</codeName>
        <description>OO-like extension</description>
        <requiredFlag>0</requiredFlag>
        <relationshipTypeName>extends</relationshipTypeName>
        <fromEntityTypeName>BusinessEntity</fromEntityTypeName>
        <toEntityTypeName>FlexEntity</toEntityTypeName>
    </TypeRelationship>

    <EntityType>
        <codeName>MetaEntity</codeName>
        <description>Base Meta Entity Types such as a GeneralWorkRequest</description>
        <serviceGroupOid>0</serviceGroupOid>
    </EntityType>

    <TypeRelationship>
        <codeName>extends</codeName>
        <description>OO-like extension</description>
        <requiredFlag>0</requiredFlag>
        <relationshipTypeName>extends</relationshipTypeName>
        <fromEntityTypeName>MetaEntity</fromEntityTypeName>
        <toEntityTypeName>FlexEntity</toEntityTypeName>
    </TypeRelationship>

    <EntityType>
        <codeName>EntityType</codeName>
        <description>Entity Type</description>
        <serviceGroupOid>0</serviceGroupOid>
    </EntityType>
    <TypeRelationship>
        <codeName>extends</codeName>
        <description>OO-like extension</description>
        <requiredFlag>0</requiredFlag>
        <relationshipTypeName>extends</relationshipTypeName>
        <fromEntityTypeName>EntityType</fromEntityTypeName>
        <toEntityTypeName>MetaEntity</toEntityTypeName>
    </TypeRelationship>

    <EntityType>
        <codeName>ProcessNode</codeName>
        <description>Process Node</description>
        <serviceGroupOid>0</serviceGroupOid>
    </EntityType>
    <TypeRelationship>
        <codeName>extends</codeName>
        <description>OO-like extension</description>
        <requiredFlag>0</requiredFlag>
        <relationshipTypeName>extends</relationshipTypeName>
        <fromEntityTypeName>ProcessNode</fromEntityTypeName>
        <toEntityTypeName>MetaEntity</toEntityTypeName>
    </TypeRelationship>

    <!--Start core domain entity types-->

    <!--
      Generated by Velocity template.
      RDB Table: BC_WORK_REQUEST
      XML Element name/Java class name: WorkRequest
    -->
    <EntityType>
        <codeName>WorkRequest</codeName>
        <description>(enter desc here)</description>
        <serviceGroupOid>0</serviceGroupOid>
    </EntityType>
    <TypeRelationship>
        <codeName>extends</codeName>
        <description>OO-like extension</description>
        <requiredFlag>0</requiredFlag>
        <relationshipTypeName>extends</relationshipTypeName>
        <fromEntityTypeName>WorkRequest</fromEntityTypeName>
        <toEntityTypeName>BusinessEntity</toEntityTypeName>
    </TypeRelationship>
    <Attribute>
        <codeName>oid</codeName>
        <description>(enter desc here)</description>
        <length>0</length>
        <parentEntityTypeName>WorkRequest</parentEntityTypeName>
        <dataTypeName>string</dataTypeName>
    </Attribute>
    <Attribute>
        <codeName>creationDate</codeName>
        <description>(enter desc here)</description>
        <parentEntityTypeName>WorkRequest</parentEntityTypeName>
        <dataTypeName>date</dataTypeName>
    </Attribute>
    <Attribute>
        <codeName>lastUpdatedDate</codeName>
        <description>(enter desc here)</description>
        <parentEntityTypeName>WorkRequest</parentEntityTypeName>
        <dataTypeName>date</dataTypeName>
    </Attribute>
    <Attribute>
        <codeName>entityTypeOid</codeName>
        <description>(enter desc here)</description>
        <parentEntityTypeName>WorkRequest</parentEntityTypeName>
        <dataTypeName>long</dataTypeName>
    </Attribute>
    <Attribute>
        <codeName>needByDate</codeName>
        <description>(enter desc here)</description>
        <parentEntityTypeName>WorkRequest</parentEntityTypeName>
        <dataTypeName>date</dataTypeName>
    </Attribute>
    <Attribute>
        <codeName>creatorPersonOid</codeName>
        <description>(enter desc here)</description>
        <parentEntityTypeName>WorkRequest</parentEntityTypeName>
        <dataTypeName>long</dataTypeName>
    </Attribute>
    <Attribute>
        <codeName>requestorPersonOid</codeName>
        <description>(enter desc here)</description>
        <parentEntityTypeName>WorkRequest</parentEntityTypeName>
        <dataTypeName>long</dataTypeName>
    </Attribute>
    <Attribute>
        <codeName>urgencyOid</codeName>
        <description>(enter desc here)</description>
        <parentEntityTypeName>WorkRequest</parentEntityTypeName>
        <dataTypeName>long</dataTypeName>
        <toEntityTypeName>WorkRequestUrgency</toEntityTypeName>
    </Attribute>
    <Attribute>
        <length>0</length>
        <codeName>requestorCc</codeName>
        <description>(enter desc here)</description>
        <parentEntityTypeName>WorkRequest</parentEntityTypeName>
        <dataTypeName>string</dataTypeName>
    </Attribute>
    <Attribute>
        <codeName>statusOid</codeName>
        <description>(enter desc here)</description>
        <parentEntityTypeName>WorkRequest</parentEntityTypeName>
        <dataTypeName>long</dataTypeName>
        <toEntityTypeName>ProcessNode</toEntityTypeName>
    </Attribute>
    <Attribute>
        <codeName>requestMotiveOid</codeName>
        <description>(enter desc here)</description>
        <parentEntityTypeOid>1</parentEntityTypeOid>
        <parentEntityTypeName>WorkRequest</parentEntityTypeName>
        <dataTypeName>long</dataTypeName>
        <toEntityTypeName>WorkRequestMotive</toEntityTypeName>
    </Attribute>
    <Attribute>
        <length>0</length>
        <codeName>resolution</codeName>
        <description>(enter desc here)</description>
        <parentEntityTypeName>WorkRequest</parentEntityTypeName>
        <dataTypeName>string</dataTypeName>
    </Attribute>

    <!--
      Generated by Velocity template.
      RDB Table: BC_GENERAL_WORK_REQUEST
      XML Element name/Java class name: GeneralWorkRequest
    -->
    <EntityType>
        <codeName>GeneralWorkRequest</codeName>
        <description>(enter desc here)</description>
        <serviceGroupOid>0</serviceGroupOid>
    </EntityType>
    <TypeRelationship>
        <codeName>extends</codeName>
        <description>OO-extension</description>
        <relationshipTypeName>extends</relationshipTypeName>
        <fromEntityTypeName>GeneralWorkRequest</fromEntityTypeName>
        <toEntityTypeName>WorkRequest</toEntityTypeName>
    </TypeRelationship>
    <Attribute>
        <length>0</length>
        <codeName>summary</codeName>
        <description>(enter desc here)</description>
        <parentEntityTypeName>GeneralWorkRequest</parentEntityTypeName>
        <dataTypeName>string</dataTypeName>
    </Attribute>
    <Attribute>
        <length>0</length>
        <codeName>description</codeName>
        <description>(enter desc here)</description>
        <parentEntityTypeName>GeneralWorkRequest</parentEntityTypeName>
        <dataTypeName>string</dataTypeName>
    </Attribute>
    <Attribute>
        <codeName>serviceableItemOid</codeName>
        <description>(enter desc here)</description>
        <parentEntityTypeName>GeneralWorkRequest</parentEntityTypeName>
        <dataTypeName>long</dataTypeName>
        <toEntityTypeName>ServiceableItem</toEntityTypeName>
    </Attribute>
    <Attribute>
        <codeName>serviceableItemTypeOid</codeName>
        <description>(enter desc here)</description>
        <parentEntityTypeName>GeneralWorkRequest</parentEntityTypeName>
        <dataTypeName>long</dataTypeName>
        <toEntityTypeName>ServiceableItem</toEntityTypeName>
    </Attribute>
    <Attribute>
        <codeName>businessImpactOid</codeName>
        <description>(enter desc here)</description>
        <parentEntityTypeName>GeneralWorkRequest</parentEntityTypeName>
        <dataTypeName>long</dataTypeName>
        <toEntityTypeName>EntityType</toEntityTypeName>
    </Attribute>
    <Attribute>
        <codeName>assignedToOid</codeName>
        <description>(enter desc here)</description>
        <parentEntityTypeName>GeneralWorkRequest</parentEntityTypeName>